TITLE,DATE,RATING,REVIEW
the best hoytel ever highly recommand,Date of stay: October 2022,50,"Make sure to go to Singapore, please must go The Fullerton Hotel! I strongly recommend it. I stayed here for two days to celebrate my mom's birthday. I was moved by the special experience and fantastic service. Especially Kate Joe is a very good hotelier! Thank you very much. She said it's the best hotel she's ever been to I'm so happy. It's an unforgettable trip."
Excellent service and staff saved me from misunderstanding this famous hotel (bez of my own stupid mistake),Date of stay: August 2022,50,"Simply fall in love immediately after entering this famous Fullerton Building at the center of the city! Every corner is full of history!!!  The staff are very nice and helpful! They first surprise us by arranging special decoration inside the room (I only mentioned to the hotel restaurant that my afternoon tea is for celebrating our anniversary but I didn’t tell the room reservation!) with two lovely bears holding the balloons (and we can take them HOME!!!!) There is complimentary update and the room is clean, capacious and comfy!  Thanks Kate, front desk staff, for helping me assisting me to finish an urgent document at work by printing the document hard copy for me and guide me for postage back to Hong Kong ! Excellent service.  I MUST thanks Albert in the Courtyard at the lobby of Fullerton. He saved me from misunderstanding the hotel!!!! I written to the restaurant 2 mths prior arrival to book their famous afternoon tea for anniversary celebration and I really had extremely high expectation bez I am fan of afternoon tea!!! I was so frustrated and furious when I start eating the tea as the taste was sooooooo horrible and unacceptable until I cannot tolerate … my hubby saw that we are having a different set from other people…. We were given a vegan set!!!!! Albert came to assist us and letting us know that according to their record, we have requested that ! We were sooooo puzzled and shocked!!! He really handled this very nicely and gave us a complete new afternoon tea set and new coffee/ tea to relieved our emotion ! Later, we searched back the email that at the very very beginning I told the reservation team that I am interested in their plant- based menu (which I don’t realised it is a completely vegan set when I looked at the menu two mths ago) ! I really highly appreciate Albert professional handling of guests and customers that he didn’t make me feel bad even eventfully I found out it is my mistake to cause misunderstanding. The way he served us make us feel not so embarrassed and saved our anniversary celebration! He told just we still have time to enjoy ourselves ^^ I feel so good for his hospitality!!!!!  Experienced staff like Albert with kind heart and hospitality is what an excellent hotel should treasure and value! Thanks a lot for saving our celebration and my impression to Fullerton (not to misunderstand bez if my own mistake)"
Excellent customer service and just a beautiful grand hotel!,Date of stay: September 2022,50,"The Fullerton is a Grand hotel. The building is stunning, and in a great location. The bay view rooms are extraordinary and the customer service is excellent. In particular, Chandra was on top of every detail and made sure not only that we felt special, but well looked after while my husband and I were out and about. Thanks Chandra and the whole team."
A hotel that must visit in Singapore,Date of stay: October 2022,50,"We visited the hotel during weekdays. Very elegant hotel. Clean and comfortable room. Breakfast service was good and we had a nice dinner in the hotel restaurant, Jade. Hotel staff are all friendly especially Shazwan from front desk has been very polite and helpful. Definitely will visit the hotel again and recommend to my friends."
Perfect hotel,Date of stay: October 2022,50,"Very nice hotel, nice view, perfect hospitality, awesome staff especially senior duty manager mr andrew yip very helpfull nice person, for those people who wanted to stay this hotel, please find mr andrew, he will give perfect hospitality, and willing to fulfill your needs. Im sure will come again n stay here."
Very nice place,Date of stay: July 2022,50,"Everything was great at this hotel.. amazing staff that is friendly and makes customers feel welcome.The rooms were clean, very comfortable, They went over and beyond to help make our stay enjoyable. . amazing that is friendly and makes customers feel welcome. highly recommend this hotel for anyone visiting singapore"
Dr,Date of stay: October 2022,50,Excellent service by Aaron and Hafiz at the Concierge desk.  Aaron was very persistent in ensuring our flying tickets are in good order. He took hours to clarify issues.  And Hafiz took care of our local trips to various places.  We highly commend both for unbeatable service.  Thank you.
Incredible building and service…,Date of stay: October 2022,50,"…which made staying here such a treat for our first night in Singapore! The conversion job done here from governmental buildings to luxury hotel is incredible and it still all looks fantastic. The swimming pool has a wonderful view to make up for the limited space and all the members of staff were really helpful and friendly, especially the door staff. Even the choice of art work in our room and on our corridor was perfect! I wish we had stayed longer…"
Wow wow wow!,Date of stay: October 2022,50,"Greetings from KL!, I received nothing but top notch service to summarize my 3 nights at this magnificent building! It was also the best time to stay there as it coincided with the F1!...Not only was the building and rooms in great state of condition, the staff at all levels, from the lobby to the rooms were immaculate. A few staff stood out above the rest mainly Zain at the concierge, Victor at the lobby and Jurianah at the front desk! All in all it was a memorable stay for all of us. You are now assured of a loyal hotel guests."
Amazing experience at Fullerton hotel,Date of stay: August 2022,50,the room is so nice and the view outside the window is beautiful.And me and my friends spend some times at the pool over looking the view in the city its relaxing moment.we went to buffet for dinner and they have alot of delicious food to choose from.
Memorable weekend for family,Date of stay: October 2022,50,"I had a wonderful experience at The Fullerton Hotel. Amazing location and my room is facing Marina Bay with a balcony. The rooms were clean, very comfortable, and the staff was very helpful. I highly recommend this hotel for anyone visiting downtown."
Incredible F1 Weekend,Date of stay: October 2022,50,"We had a wonderful stay for F1 Weekend Newly renovated room with balcony overlooking Turn 13 and the whole of Marina Bay. Attentive staff, and excellent food. The pool deck has great views over Singapore river and downtown. Huge thanks to Terry and team for giving us an amazing weekend of memories."
Super Hotel with a few niggles,Date of stay: September 2022,50,"On early arrival on a very damp September morning with high expectations we were slightly deflated not to get an immediate early check in but this was tempered by the coffee and cake provided by a very kind staff member. We were allocated our room at 10.30 and had to pay a £660 pre authorisation that I felt was a little unreasonable . However that was the downside as the remainder of our stay was memorable. Our room was luxurious and had super views of the Quay and every item one wished for was to hand. The concierge even provided umbrellas. The breakfast buffet was excellent and the whole team worked extremely hard. This is an outstanding hotel and there were niggles such as being told there were no tables available in Jade but to return a couple of hours later (looking much smarter) and were immediately shown to our table. The dinner at Jade, though expensive, was superb and we enjoyed every mouthful. Niggles aside the comfort and quality were superb"
Nice but forgettable,Date of stay: September 2022,30,"It was a pleasant stay with our kids but nothing very memorable. The kids love the bed and bath tub, the tv channels and the breakfast spread like any other hotels. There isn't much activities for kids but this isn't a family friendly hotel to begin with. But our request for a small cake to celebrate their belated birthday wasn't attended to, even after asking about it twice. We learnt from friends that kids usually receive a mini Fullerton Bear during check-in and requested for 1 during check out but was turned down by being ignored by the concierge. It would have been a nice stay for couples but not for family. Probably won't come again."
Beautiful hotel in a great location.,Date of stay: August 2022,40,"This was our second stay at the Fullerton Hotel. We love the old world charm of the hotel as well as the location being close to the river with lots of restaurants and raffles MRT station. All of the staff are extremely friendly and helpful making you feel right at home. A special mention must go to Sall around the pool. He always greets you with a smile and ice cold water and loves to have a chat with the guests. He is a real credit to the hotel. We stayed in a heritage room overlooking the marina. It was kept clean with plenty of towels. Maybe they could replenish the soaps etc a bit more regularly. We ate breakfast in the Town restaurant every morning and although the variety was fantastic the western style food was always cold, except for the freshly made eggs! It didn’t matter if you were there at the start of service or a couple of hours in. This is a major issue that needs to be rectified. We also ate at the seafood buffet one night and it was the same. Quite disappointing for the price you have to pay. The pool area is spectacular and a great way to spend a few hours after sightseeing. Can’t wait to return on our next visit to Singapore!"
Great 3 nights stay - Straits Club,Date of stay: September 2022,50,"Had an excellent stay in at the Fullerton for 3 nights in September, we enjoyed Straits club breakfast afternoon tea and evening cocktails and canapés! Crystal and Ryan were wonderful and very attentive throughout our stay - we can’t wait to come back with family at Easter time next year!"
Location and rooms are superior,Date of stay: September 2022,40,"We stayed twice in week in two seperate bookings. Our rooms where renovated and had views out over the bay. Room service was amazing and suited our palates after both flights where delayed.  Our third night was a disaster, due to the airline cancelling our flight. The issue being we had to take the last room that seemed to be available, it was hot and unrenovated on level 4. Sadly the hotel was fully booked due to the Grand Prix lead up. The room was oversized and a window which if you stood on a chair it has a view. We just couldn’t resist to take a photo as my husband is ‘6.4’.  Overall we liked our stay but the last night stay was substandard for the price tag.  The stand out team member was Chandra at the door who helped with our room swap and front door."
Staff,Date of stay: September 2022,50,Chandra was very nice and his services were great. Excellent at his job. He offered to call taxis every time be saw us in the lobby and all the other staff had great recommendations as well. Cleaning services are excellent no need to worry.
Fantastic Hotel!!,Date of stay: September 2022,50,"Amazing hotel with amazing service! Checkin was flawless and the room was well appointed. No refreshing needed in the room as everything was neat, clean, and not showing any signs of wear and tear. Mini bar and snacks were great.  For breakfast, the cafe in the lobby was good. No complaints whatsoever ever. If you are looking for old world charm with newer amenities, this is the place to stay.  For guests, two things to consider, there isn’t a hotel “gift” shop so if you need meds, drinks, snacks, there is a 24 Hr 7-11 less than 10min walk. Also, I did have a terrible experience at the Spa, but not holding that against the hotel given it is separate. Be very careful when booking any service with the spa. Never again!"
Luxury overlooking the bay,Date of stay: September 2022,50,"We loved the service and room at this hotel which is conveniently located to the train. We had a small balcony that overlooked the bay. The room was quiet, well appointed, and very comfortable. The pool was small so we skipped using it. The Town restaurant had a good breakfast buffet."
Daughter's 22nd Birthday,Date of stay: September 2022,40,"My family staycation at the Palladian Suite is satisfactory. The staff are commendable and Strait Club privileges are excellent! We dined well at Town Restaurant & Courtyard ; Mr Kumar Duty Mgr at the latter went out of his way to wrap up our staycation with distinction by accommodating to our needs. The SPA was excellent too. An improvement to make is to ensure room amenities prepared for the number of registered adults upon check in. I wasted time requesting for the third of everything (slipper, bath robe & towel, tooth brush etc) for my family of 3 despite the same request made at reservation. I am open to visiting The Fullerton again!"
"Nice historic hotel. walking distance to tourist, business district and food area, expect nonhalal kitchen but can request halal",Date of stay: September 2022,50,"A well maintained historic hotel in the heart of Singapore.  We stayed here as a family of 4, driven all the way from Kuala Lumpur, the concierge were helpful and frontdesk made me felt that checkin is so effortless. When you arrived at the main entrance, a nice ambiance of serenity and friendliness greeted you. Among the few hotels I've stayed before with nice scent in the air.  The breakfast was scrumptious, although the kitchen was not Halal certified. We opted mostly on vegetarian and seafoods, which still have a good range of selection. Kids were thrilled to be given colouring kits and free scoop of ice cream. Price wise a bit pricey, but then again I think it was the standard price for its class.  The pool on the other hand was a bit small or nothing too fancy for kids to really want to dive in.  Rooms were well maintained, although the lifts are located on either end of the building. So if your room is right smack in the middle, expect a little bit more of a walk as compared to those near the lifts.  Location wise is the best, near to food outlets, historic locations, business district and tourist attractions."
"From Sabah, Malaysia",Date of stay: September 2022,50,"Superb facilities, comfortable room and strategic location. Concierge service specially Chandra was awesome from guide to check in counters, introduced all the function in the room to carrying the luggages and bags with smile and care plus looking out for the cab while I sit back and rest. Well done"
What a luxurious hotel!,Date of stay: August 2022,50,"What a luxurious hotel with historic features and classical beauty. This hotel will be the first and last classic moody hotel in this bustling city center. Esay to meet view of famous marinabay hotel at any angle within 5 min walk distance. The afternoon tea set was oppulent and accompanied by relaxing music .Great location, a walk away from trendy hotspots."
Top notch property,Date of stay: August 2022,50,This is a truly high end property. I would recommend this place over MB Sands any day. Feels exclusive and does not have the swarms of tourists that you find across the bay. Very pleased with the room size and staff service.
Amazing Hotel!,Date of stay: September 2022,50,"First time ever visiting Fullerton Hotel Singapore last week. was in awe, very beautiful and super clean rooms, very friendly staff, the breakfast buffet was out of this world! They even had a piece of birthday cake for me at my arrival of in my room..so thoughtful! I hope on my next visit to Singapore, i can stay there again, very recommendable!"
Great location and decor. Terrible service.,Date of stay: September 2022,30,"Came to The Fullerton Hotel Singapore for a business conference. The location is convenient and decor is immaculate. Would love visit this location again.  However, the service staff can be quite unhelpful, preferring to tell you ""I don't know"" instead of giving some assistance - I was trying to find a charging port for work and one of their wall ports was not working. I tried look around the lobby and instead of directing my to any functioning ports, preferred to tell me that I am not allow to sit at this or that location. Not sure if this is the kind of service I would like to bring my clients to. I think Pan Pacific would have been a better choice."
"If you want the best hotel in Singapore, this is it",Date of stay: September 2022,50,"We have stayed at The Fullerton a number of times previously. Never disappointed. It is truly a fabulous hotel in every aspect. This time we stayed 9 days. Our room was very clean and comfortable with great views out over Marina Bay. The bathroom was spotless, had lots of space and amenities. Our room was on the same floor as the Straits Club, so access was easy.  Nicholas, Siti and the Team at the Straits Club were as usual proactive, attentive and extremely helpful. Food and drinks were high quality and very tempting. Ryan, Chia Yi, Crystal and Zep provided exceptional service. They made our stay most enjoyable.  We took the Fullerton Heritage Tour this time. Bill the tour guide was very knowledgeable. The tour brought back wonderful memories for us, as we used to post letters here at the GPO when we lived in Singapore many years ago. The building has been tastefully renovated while still keeping many of the original GPO features.  The hotel is situated in a great location. An easy walk to the MRT, buses also at the front of the hotel and the river walks are pleasant.  Looking forward to visiting again early next year."
Wonderful staycation!,Date of stay: September 2022,50,"The holistic service provided by Fullerton hotel was nothing short of perfect. From the restaurant (Courtyard) to the in-room dining service, you could tell that their staff were trained very well as it’s reflected in the impeccable service provided to me during my short stay there.  Special mention to Lalikumar (pardon if the spelling is off) from the Courtyard. His attention to detail was highly commendable. Knowing that my family and I have certain dietary restriction, he went beyond his duty to cater to us by substituting the item in our high tea set.  All and all, thank you for the awesome stay and I look forward to another superb staycation at the Fullerton hotel, hopefully in the near future ☺️."
The best honeymoon start,Date of stay: September 2022,50,"What a stunning hotel! The staff couldn’t have done more to help us. Our room was beautiful and the bathroom was huge! Such a lovely touch being given a delicious cake to celebrate our honeymoon. The location is fantastic- walking distance to Fullerton bay and the embankment overlooking Marina Bay Sands. The breakfast was unbelievable- we had it once as it’s quite a hefty cost, but well worth it. If we return to Singapore (which we hope to do as we loved it), we will be sure to stay here."
Fullerton Hotel,Date of stay: September 2022,50,Lovely hi-tea set. Live entertainment with wonderful harp performance with movie and Disney soundtracks We were happy to be served by Mr Lalikumar. The hi-tea were exquisite and delicious with variety of tea and coffee choices.
Fullerton Hotel,Date of stay: September 2022,50,Lalikumar is of great service and friendly . Have a great day and enjoy ourselves here. Nice music and nice ambience. Good place to enjoy with friends and family. ........Thanks alot....................
Best for everything.,Date of stay: September 2022,50,"Stay in Quay Room at 7th floor. Beautifull view from balcony (but I have to climb the chair for the best view). We can see the two legendary bridges, Boat Quay, Asian Civilitation Museum, Parlement House, Raffles Statue, UOB tower etc. Beautifull view from swimming pool. And thank you for Sall (pool guard) , you are a good man, give me some information about everything.  The food, cakes are very delicious. The lunch buffet was so great. I love it. Thank you for give a slice cake for my husband (birthday slice cake). I love the herritage walk tour. Thank you for Linda, you are the good herritage tour guide.  Will be back again for sure."
Great location and grand hotel,Date of stay: September 2022,40,Stayed for 5 nights in a premier courtyard room. Room was refurbished. Bathroom was huge by Singapore hotel standards. I kept the curtains closed most of the time. I picked the Fullerton because I like hotels that have character. A lot of 5 star hotels in my opinion are soulless and the same. The location was fabulous for the things that interest me. Being so close to the Merlion and waterways was great. The train station is so close as well. The staff that stood out for me were the concierge and front door man. Sharing tips on quickest transportation routes etc. Breakfast was plentiful but I do wish it went to 11am instead of 10:30am. I like to sleep in on holidays. I was able to use facilities after check out such as showering which is extremely helpful when flights are late in the evening. The surrounding areas are pretty too at night. Boat Quay and Clarke Quay easy walks even in the humidity. I would stay again.
Fullerton Suite with family of four,Date of stay: September 2022,50,We booked a 1 night weekday staycation at the Fullerton for our family of four. The hotel is beautifully presented and the lobby staff are helpful and friendly. Check in was quick and easy. We received a upgraded suite on arrival (we were not told it was an upgrade at the desk but from the website pictures it looked like the Fullerton Suite). The suite had an very big balcony and a view onto the river and partially onto the bay/mbs. The main bed is very comfortable and my kids slept well on the sofa bed and additional roll out.  The service at the straits club was excellent and i particularly want to commend Crystal and Ryan for their attentiveness and level of service. Tip for the club level: check-in is at 3pm but first seating for afternoon tea is 1:30-3pm so if you wanted to arrive early you could relax with tea in the club while waiting for your room.  The pool is long and slightly rhonboid shaped and has a nice view onto the Singapore river. The water is warm so nice for kids. Not sure if it gets crowded on weekends.  Nice touch of a free scoop of ice cream for kids. Overall a big thumbs up and would love to stay again!
Fantastic Hotel and Location.,Date of stay: July 2022,50,"What a fantastic stay at The Fullerton,from arriving everyone made your welcome seem like you were of importance.location is superb,MRT for all places of interest and Boat Quay for food and drinks.Breakfast was superb and a great choice of food and service,room nice and airy,the toilet was very futuristic with all the gadgets.Would definitely recommend,and will always stay her when in Singapore."
Fabulous stay with family,Date of stay: September 2022,50,"My first stay at The Fullerton Hotel and I’m deeply impressed by the service, cleanliness and everything! Checkin was seamless and quick, and receptionist is considerate to ask me if my child is allowed ice cream before offering my 4 years old a name tag with lanyard (entitles her for 2 rounds of ice cream), crayons and activity book. My girl broke her crayons and was upset, and the receptionist happily offered her a new set together with the activity book much to her delight. When I called for a ‘flat’ pillow for my child, we were given a child pillow instead (which is exactly what we wished for), and we didn’t have to wait long for them to come over too. And impressively, we were greeted when we called for service. Wifi was speedy, although we don’t really need it. The infinity pool is beautiful, overlooking the waters. We requested for an extra bed, and it was all done up when we arrived in the room too. We were celebrating a birthday and we got a slice of chocolate cake (extra rich and yummy) delivered to the room. Oh… the breakfast buffet spread was fantastic, everything was so freshly prepared and beautifully set. Waitress was so quick to clear our used utensils and cutlery too. Check out was the fastest, by just returning the room keys. A wonderful heritage hotel that pays attention to every single details, that you’ll definitely feel so welcome, for locals and visitors!"
Singapore Holiday,Date of stay: August 2022,50,"Another stay at The Fullerton Singapore, our 4th visit. It is always sad to leave the Fullerton because you feel so pampered during your stay. The staff are exceptional, friendly and never fail to go the extra mile to ensure that guests feel totally spoilt. The Fullerton is a classic colonial experience, centrally located and the perfect base to explore Singapore. My wife & I love escaping Australia’s cold winter and spending a week or so at the beautiful & friendly Fullerton Hotel in Singapore. We can’t wait to return :)"
